{
  "format": "mimi-live2d-rig",
  "version": 1,
  "name": "taiga",
  "canvas": {
    "w": 1000,
    "h": 747
  },
  "embed": false,
  "rootPivot": {
    "x": 494,
    "y": 416
  },
  "parts": [
    {
      "id": "tail",
      "role": "tail",
      "z": 1,
      "parent": null,
      "rect": {
        "x": 47,
        "y": 150,
        "w": 305,
        "h": 442
      },
      "pivot": {
        "x": 351,
        "y": 425
      },
      "opacity": 1,
      "scale": {
        "x": 1,
        "y": 1
      },
      "offset": {
        "x": 0,
        "y": 0
      },
      "rot": 0,
      "flip": {
        "h": false,
        "v": false
      },
      "motion": {
        "breathing": 0.15,
        "blinkable": false,
        "sway": {
          "amp": 0,
          "freq": 0.25,
          "phase": 0,
          "axis": "rot"
        },
        "bend": {
          "amp": 0.11,
          "freq": 0.55,
          "axis": "x",
          "strips": 12,
          "rootEdge": "right"
        },
        "gaze": {
          "tx": 0,
          "ty": 0
        },
        "flutter": 0,
        "jiggle": null
      },
      "file": "parts/tail.webp"
    },
    {
      "id": "body",
      "role": "body",
      "z": 2,
      "parent": null,
      "rect": {
        "x": 340,
        "y": 244,
        "w": 601,
        "h": 350
      },
      "pivot": {
        "x": 640,
        "y": 419
      },
      "opacity": 1,
      "scale": {
        "x": 1,
        "y": 1
      },
      "offset": {
        "x": 0,
        "y": 0
      },
      "rot": 0,
      "flip": {
        "h": false,
        "v": false
      },
      "motion": {
        "breathing": 0.15,
        "blinkable": false,
        "sway": {
          "amp": 0,
          "freq": 0.25,
          "phase": 0,
          "axis": "rot"
        },
        "bend": null,
        "gaze": {
          "tx": 0,
          "ty": 0
        },
        "flutter": 0,
        "jiggle": null
      },
      "file": "parts/body.webp"
    }
  ]
}
